{
    "name": "workflow-test",
    "description": "Trace generated with WorkflowHub - https://workflowhub.org",
    "createdAt": "2020-12-19T23:38:32.986156",
    "schemaVersion": "1.4",
    "author": {
        "name": "rafsilva",
        "email": "support@workflowhub.org"
    },
    "wms": {
        "name": "Pegasus",
        "version": "5.0",
        "url": "https://pegasus.isi.edu"
    },
    "workflow": {
        "executedAt": "12-19-20T21:31:53Z",
        "machines": [
            {
                "nodeName": "worker-4",
                "system": "linux",
                "architecture": "x86_64",
                "release": "4.15.0-121-generic",
                "cpu": {
                    "count": 48,
                    "speed": 1274,
                    "vendor": "GenuineIntel"
                },
                "memoryInBytes": 131795960000
            }
        ],
        "tasks": [
            {
                "name": "bowtie2-build_ID0000001",
                "type": "compute",
                "parents": [],
                "children": [
                    "bowtie2_ID0000003",
                    "bowtie2_ID0000013",
                    "bowtie2_ID0000005",
                    "bowtie2_ID0000015",
                    "bowtie2_ID0000021",
                    "bowtie2_ID0000011",
                    "bowtie2_ID0000007",
                    "bowtie2_ID0000017",
                    "bowtie2_ID0000009",
                    "bowtie2_ID0000019"
                ],
                "files": [
                    {
                        "link": "output",
                        "name": "reference.rev.1.bt2",
                        "sizeInBytes": 4226858
                    },
                    {
                        "link": "output",
                        "name": "reference.2.bt2",
                        "sizeInBytes": 24280
                    },
                    {
                        "link": "output",
                        "name": "reference.4.bt2",
                        "sizeInBytes": 24273
                    },
                    {
                        "link": "output",
                        "name": "reference.3.bt2",
                        "sizeInBytes": 17
                    },
                    {
                        "link": "output",
                        "name": "reference.1.bt2",
                        "sizeInBytes": 4226858
                    },
                    {
                        "link": "output",
                        "name": "reference.rev.2.bt2",
                        "sizeInBytes": 24280
                    },
                    {
                        "link": "input",
                        "name": "reference.fna",
                        "sizeInBytes": 98721
                    }
                ],
                "avgCPU": 6.1398,
                "memory": 94720,
                "priority": 20,
                "machine": "worker-4",
                "id": "ID0000001",
                "category": "bowtie2-build",
                "command": {
                    "program": "bowtie2-build",
                    "arguments": [
                        "reference.fna",
                        "reference"
                    ]
                },
                "runtimeInSeconds": 6.352,
                "memoryInBytes": 94720000
            },
            {
                "name": "fasterq-dump_ID0000002",
                "type": "compute",
                "parents": [],
                "children": [
                    "bowtie2_ID0000003"
                ],
                "files": [
                    {
                        "link": "output",
                        "name": "SRR3152141_2.fastq",
                        "sizeInBytes": 734761744
                    },
                    {
                        "link": "output",
                        "name": "SRR3152141_1.fastq",
                        "sizeInBytes": 734761744
                    }
                ],
                "avgCPU": 3.5286,
                "memory": 324392,
                "priority": 20,
                "machine": "worker-4",
                "id": "ID0000002",
                "category": "fasterq-dump",
                "command": {
                    "program": "fasterq-dump",
                    "arguments": [
                        "--split-files",
                        "SRR3152141"
                    ]
                },
                "runtimeInSeconds": 896.867,
                "memoryInBytes": 324392000
            },
            {
                "name": "bowtie2_ID0000003",
                "type": "compute",
                "parents": [
                    "bowtie2-build_ID0000001",
                    "fasterq-dump_ID0000002"
                ],
                "children": [
                    "merge_ID0000022"
                ],
                "files": [
                    {
                        "link": "input",
                        "name": "reference.rev.1.bt2",
                        "sizeInBytes": 4226858
                    },
                    {
                        "link": "input",
                        "name": "reference.2.bt2",
                        "sizeInBytes": 24280
                    },
                    {
                        "link": "input",
                        "name": "reference.4.bt2",
                        "sizeInBytes": 24273
                    },
                    {
                        "link": "input",
                        "name": "reference.3.bt2",
                        "sizeInBytes": 17
                    },
                    {
                        "link": "output",
                        "name": "SRR3152141.bam",
                        "sizeInBytes": 316
                    },
                    {
                        "link": "input",
                        "name": "SRR3152141_1.fastq",
                        "sizeInBytes": 734761744
                    },
                    {
                        "link": "input",
                        "name": "reference.1.bt2",
                        "sizeInBytes": 4226858
                    },
                    {
                        "link": "output",
                        "name": "SRR3152141.bam.bai",
                        "sizeInBytes": 24
                    },
                    {
                        "link": "input",
                        "name": "reference.rev.2.bt2",
                        "sizeInBytes": 24280
                    },
                    {
                        "link": "input",
                        "name": "SRR3152141_2.fastq",
                        "sizeInBytes": 734761744
                    }
                ],
                "avgCPU": 103.8255,
                "memory": 27096,
                "priority": 30,
                "machine": "worker-4",
                "id": "ID0000003",
                "category": "bowtie2",
                "command": {
                    "program": "bowtie2",
                    "arguments": [
                        "SRR3152141"
                    ]
                },
                "runtimeInSeconds": 54.137,
                "memoryInBytes": 27096000
            },
            {
                "name": "fasterq-dump_ID0000004",
                "type": "compute",
                "parents": [],
                "children": [
                    "bowtie2_ID0000005"
                ],
                "files": [
                    {
                        "link": "output",
                        "name": "SRR3152151_1.fastq",
                        "sizeInBytes": 345787144
                    },
                    {
                        "link": "output",
                        "name": "SRR3152151_2.fastq",
                        "sizeInBytes": 345787144
                    }
                ],
                "avgCPU": 3.4026,
                "memory": 187340,
                "priority": 20,
                "machine": "worker-4",
                "id": "ID0000004",
                "category": "fasterq-dump",
                "command": {
                    "program": "fasterq-dump",
                    "arguments": [
                        "--split-files",
                        "SRR3152151"
                    ]
                },
                "runtimeInSeconds": 452.479,
                "memoryInBytes": 187340000
            },
            {
                "name": "bowtie2_ID0000005",
                "type": "compute",
                "parents": [
                    "bowtie2-build_ID0000001",
                    "fasterq-dump_ID0000004"
                ],
                "children": [
                    "merge_ID0000022"
                ],
                "files": [
                    {
                        "link": "input",
                        "name": "reference.rev.1.bt2",
                        "sizeInBytes": 4226858
                    },
                    {
                        "link": "input",
                        "name": "reference.2.bt2",
                        "sizeInBytes": 24280
                    },
                    {
                        "link": "output",
                        "name": "SRR3152151.bam.bai",
                        "sizeInBytes": 24
                    },
                    {
                        "link": "input",
                        "name": "reference.4.bt2",
                        "sizeInBytes": 24273
                    },
                    {
                        "link": "input",
                        "name": "reference.3.bt2",
                        "sizeInBytes": 17